{
  "targetNameBefore": "HUD_v1",
  "targetNameAfter": "HUD_v2",
  "timestamp": "2026-10-25T12:00:00.0000000Z",
  "changes": [
    {
      "nodeId": "/HUD/SettingsButton",
      "nodeName": "SettingsButton",
      "changeType": "Resized",
      "description": "Resolved size changed from (48x48) to (64x64).",
      "beforeValue": "48x48",
      "afterValue": "64x64"
    }
  ]
}
